{
  "fixture_id": "1ae5bb3f-4710-4460-b203-d5ac946da082",
  "corpus_version": 1,
  "created_at": "2026-07-11T23:04:01.865Z",
  "last_verified_at": "2026-07-12T11:13:20.111Z",
  "source": "auto_generator",
  "category": "city",
  "region": "mkad_ring",
  "tags": [
    "auto_v1",
    "city",
    "mkad_ring"
  ],
  "waypoints": [
    {
      "lat": 55.572475,
      "lon": 37.632114,
      "label": "start"
    },
    {
      "lat": 55.810198,
      "lon": 37.665989,
      "label": "via_1"
    },
    {
      "lat": 55.837692,
      "lon": 37.845091,
      "label": "finish"
    }
  ],
  "constraints": {
    "distance_km_min": 5,
    "distance_km_max": 300,
    "sim_speed_kmh": 45
  },
  "references": {
    "graphhopper": {
      "distance_m": 49403,
      "duration_s": 4387,
      "maneuver_count": 20,
      "roundabout_count": 0,
      "fetched_at": "2026-07-12T08:43:25.085Z",
      "fetch_error": null,
      "provider_meta": {
        "profile": "car",
        "points_sent": 3,
        "points_original": 3,
        "downsampled": false
      }
    },
    "openrouteservice": {
      "distance_m": 63057,
      "duration_s": 4213,
      "maneuver_count": 20,
      "roundabout_count": 0,
      "fetched_at": "2026-07-12T11:05:48.976Z",
      "fetch_error": null,
      "provider_meta": {
        "profile": "driving-car"
      }
    },
    "yandex_web": null
  },
  "motohud": {
    "distance_m": 52843,
    "duration_s": 3981,
    "step_count": 43,
    "router": "osrm",
    "fetched_at": "2026-10-22T07:47:45.835Z",
    "fetch_error": null
  },
  "metrics": {
    "graphhopper_vs_motohud": {
      "hausdorff_m": 4260.936132376808,
      "avg_lateral_m": 703.0484025917317,
      "p50_lateral_m": 0.6147046394691897,
      "p95_lateral_m": 3810.7862463713,
      "max_lateral_m": 4260.936132376808,
      "length_diff_pct": 6.511619105291046,
      "duration_diff_pct": 11.119554204660588,
      "maneuver_count_diff": 24,
      "roundabout_count_diff": null,
      "direction_mismatch_ratio": 0.340080971659919,
      "waypoint_deviations_m": [
        0,
        0,
        0
      ]
    },
    "ors_vs_motohud": {
      "hausdorff_m": 7264.464450394346,
      "avg_lateral_m": 2511.1349390969167,
      "p50_lateral_m": 2123.0587645901155,
      "p95_lateral_m": 6565.605196537736,
      "max_lateral_m": 7116.802263636606,
      "length_diff_pct": 19.32669744909545,
      "duration_diff_pct": 6.71225937183384,
      "maneuver_count_diff": 24,
      "roundabout_count_diff": null,
      "direction_mismatch_ratio": 0.47248576850094876,
      "waypoint_deviations_m": [
        0.25547158134649367,
        0,
        104.64612350008832
      ]
    },
    "yandex_vs_motohud": null,
    "graphhopper_vs_ors": {
      "hausdorff_m": 11095.315046900754,
      "avg_lateral_m": 2917.4951166485894,
      "p50_lateral_m": 2083.589541490511,
      "p95_lateral_m": 8860.616810634316,
      "max_lateral_m": 9578.439266838472,
      "length_diff_pct": 27.637997692447826,
      "duration_diff_pct": 3.9662639617050375,
      "maneuver_count_diff": 0,
      "roundabout_count_diff": 0,
      "direction_mismatch_ratio": 0.5921052631578947,
      "waypoint_deviations_m": [
        0.25547158134649367,
        0,
        104.64612350008832
      ]
    },
    "graphhopper_vs_yandex": null,
    "ors_vs_yandex": null,
    "consensus_deviation": {
      "refs_agree": false,
      "motohud_vs_consensus_p95_m": 6565.605196537736,
      "motohud_vs_consensus_avg_m": 1607.0916708443242,
      "signal": "fail"
    },
    "coverage": {
      "references_available": [
        "graphhopper",
        "openrouteservice"
      ]
    }
  },
  "metadata": {
    "author": "generate-waypoints.mjs",
    "notes": "МКАД и ТТК · city · OSRM 52.8 km",
    "known_issues": [],
    "compare_interpretation": null,
    "priority": "normal"
  },
  "status": "valid"
}
