{
  "fixture_id": "31d269eb-f247-4da3-bfbf-16c2033133ce",
  "corpus_version": 1,
  "created_at": "2026-07-12T05:27:35.049Z",
  "last_verified_at": "2026-07-12T11:16:19.747Z",
  "source": "auto_generator",
  "category": "many_waypoints",
  "region": "sochi_adler",
  "tags": [
    "auto_v1",
    "many_waypoints",
    "sochi_adler"
  ],
  "waypoints": [
    {
      "lat": 43.634772,
      "lon": 39.906663,
      "label": "start"
    },
    {
      "lat": 43.441457,
      "lon": 40.024982,
      "label": "via_1"
    },
    {
      "lat": 43.539698,
      "lon": 40.092366,
      "label": "via_2"
    },
    {
      "lat": 43.602552,
      "lon": 40.040817,
      "label": "via_3"
    },
    {
      "lat": 43.611823,
      "lon": 39.925536,
      "label": "via_4"
    },
    {
      "lat": 43.45413,
      "lon": 39.902035,
      "label": "finish"
    }
  ],
  "constraints": {
    "distance_km_min": 5,
    "distance_km_max": 300,
    "sim_speed_kmh": 70
  },
  "references": {
    "graphhopper": {
      "distance_m": 167642,
      "duration_s": 13663,
      "maneuver_count": 59,
      "roundabout_count": 0,
      "fetched_at": "2026-07-12T09:44:23.198Z",
      "fetch_error": null,
      "provider_meta": {
        "profile": "car",
        "points_sent": 5,
        "points_original": 6,
        "downsampled": true
      }
    },
    "openrouteservice": {
      "distance_m": null,
      "duration_s": null,
      "maneuver_count": null,
      "roundabout_count": null,
      "fetched_at": "2026-07-12T11:06:10.981Z",
      "fetch_error": "Could not find routable point within a radius of 350.0 meters of specified coordinate 0: 39.9066630 43.6347720."
    },
    "yandex_web": null
  },
  "motohud": {
    "distance_m": 223069,
    "duration_s": 30268,
    "step_count": 93,
    "router": "osrm",
    "fetched_at": "2026-10-22T07:48:08.184Z",
    "fetch_error": null
  },
  "metrics": {
    "graphhopper_vs_motohud": {
      "hausdorff_m": 7443.283589705478,
      "avg_lateral_m": 885.7723300285637,
      "p50_lateral_m": 19.131841698818757,
      "p95_lateral_m": 6546.3365064819245,
      "max_lateral_m": 7443.283589705478,
      "length_diff_pct": 24.848816306769532,
      "duration_diff_pct": 54.86140936271433,
      "maneuver_count_diff": 34,
      "roundabout_count_diff": null,
      "direction_mismatch_ratio": 0.6104069379586391,
      "waypoint_deviations_m": [
        0,
        0,
        7285.8300427544455,
        535.4893915655264,
        12.090303697042565,
        38.83657707631536
      ]
    },
    "ors_vs_motohud": null,
    "yandex_vs_motohud": null,
    "graphhopper_vs_ors": null,
    "graphhopper_vs_yandex": null,
    "ors_vs_yandex": null,
    "consensus_deviation": {
      "refs_agree": false,
      "motohud_vs_consensus_p95_m": 6546.3365064819245,
      "motohud_vs_consensus_avg_m": 885.7723300285637,
      "signal": "insufficient_refs"
    },
    "coverage": {
      "references_available": [
        "graphhopper"
      ]
    }
  },
  "metadata": {
    "author": "generate-waypoints.mjs",
    "notes": "Сочи — Адлер · many_waypoints · OSRM 223.1 km",
    "known_issues": [],
    "compare_interpretation": null,
    "priority": "normal"
  },
  "status": "valid"
}
