{
  "fixture_id": "4e61a649-8e32-4ed2-87b3-3b71991ca196",
  "corpus_version": 1,
  "created_at": "2026-07-12T05:29:55.023Z",
  "last_verified_at": "2026-07-12T11:20:13.647Z",
  "source": "auto_generator",
  "category": "roundabouts",
  "region": "spb_center",
  "tags": [
    "auto_v1",
    "roundabouts",
    "spb_center"
  ],
  "waypoints": [
    {
      "lat": 55.656061,
      "lon": 37.400556,
      "label": "start_ring"
    },
    {
      "lat": 55.661355,
      "lon": 37.399264,
      "label": "via_ring_1"
    },
    {
      "lat": 55.661088,
      "lon": 37.414604,
      "label": "finish_ring"
    }
  ],
  "constraints": {
    "distance_km_min": 5,
    "distance_km_max": 300,
    "sim_speed_kmh": 45
  },
  "references": {
    "graphhopper": {
      "distance_m": 9472,
      "duration_s": 1000,
      "maneuver_count": 14,
      "roundabout_count": 0,
      "fetched_at": "2026-07-12T10:53:25.744Z",
      "fetch_error": null,
      "provider_meta": {
        "profile": "car",
        "points_sent": 3,
        "points_original": 3,
        "downsampled": false
      }
    },
    "openrouteservice": {
      "distance_m": 9412,
      "duration_s": 964,
      "maneuver_count": 10,
      "roundabout_count": 0,
      "fetched_at": "2026-07-12T11:06:41.113Z",
      "fetch_error": null,
      "provider_meta": {
        "profile": "driving-car"
      }
    },
    "yandex_web": null
  },
  "motohud": {
    "distance_m": 9843,
    "duration_s": 926,
    "step_count": 28,
    "router": "osrm",
    "fetched_at": "2026-10-15T07:37:21.147Z",
    "fetch_error": null
  },
  "metrics": {
    "graphhopper_vs_motohud": {
      "hausdorff_m": 132.2969251999006,
      "avg_lateral_m": 3.0200585532041115,
      "p50_lateral_m": 0.053040091664857215,
      "p95_lateral_m": 0.945177171496189,
      "max_lateral_m": 132.2969251999006,
      "length_diff_pct": 3.7691760642080663,
      "duration_diff_pct": 7.874865156418555,
      "maneuver_count_diff": 14,
      "roundabout_count_diff": null,
      "direction_mismatch_ratio": 0.12631578947368421,
      "waypoint_deviations_m": [
        0,
        0.11119507995279233,
        0.12544738910516262
      ]
    },
    "ors_vs_motohud": {
      "hausdorff_m": 132.2969251999006,
      "avg_lateral_m": 4.196923952641487,
      "p50_lateral_m": 0.053040091664857215,
      "p95_lateral_m": 30.555442063539132,
      "max_lateral_m": 132.2969251999006,
      "length_diff_pct": 4.378746317179721,
      "duration_diff_pct": 3.9913700107874863,
      "maneuver_count_diff": 18,
      "roundabout_count_diff": null,
      "direction_mismatch_ratio": 0.1164021164021164,
      "waypoint_deviations_m": [
        0,
        0.11119507995279233,
        60.24217879035938
      ]
    },
    "yandex_vs_motohud": null,
    "graphhopper_vs_ors": {
      "hausdorff_m": 60.229551322883104,
      "avg_lateral_m": 1.2926758015653257,
      "p50_lateral_m": 0.03806570026751202,
      "p95_lateral_m": 0.7025131548389724,
      "max_lateral_m": 60.229551322883104,
      "length_diff_pct": 0.6334459459459459,
      "duration_diff_pct": 3.5999999999999996,
      "maneuver_count_diff": 4,
      "roundabout_count_diff": 0,
      "direction_mismatch_ratio": 0.005291005291005291,
      "waypoint_deviations_m": [
        0,
        0.11119507995279233,
        60.24217879035938
      ]
    },
    "graphhopper_vs_yandex": null,
    "ors_vs_yandex": null,
    "consensus_deviation": {
      "refs_agree": true,
      "motohud_vs_consensus_p95_m": 30.555442063539132,
      "motohud_vs_consensus_avg_m": 3.6084912529227995,
      "signal": "warn"
    },
    "coverage": {
      "references_available": [
        "graphhopper",
        "openrouteservice"
      ]
    }
  },
  "metadata": {
    "author": "generate-waypoints.mjs",
    "notes": "СПб — центр · roundabouts · OSRM 9.8 km",
    "known_issues": [],
    "compare_interpretation": null,
    "priority": "normal"
  },
  "status": "valid"
}
