{
  "fixture_id": "4c35729c-f3d8-4c52-8aac-900fdcf30b2f",
  "corpus_version": 1,
  "created_at": "2026-07-11T13:57:51.134Z",
  "last_verified_at": "2026-07-12T11:20:11.749Z",
  "source": "auto_generator",
  "category": "highway",
  "region": "m4_don_south",
  "tags": [
    "auto_v1",
    "highway",
    "m4_don_south"
  ],
  "waypoints": [
    {
      "lat": 51.035378,
      "lon": 40.437952,
      "label": "start"
    },
    {
      "lat": 49.846162,
      "lon": 39.683954,
      "label": "finish"
    }
  ],
  "constraints": {
    "distance_km_min": 5,
    "distance_km_max": 300,
    "sim_speed_kmh": 90
  },
  "references": {
    "graphhopper": {
      "distance_m": 184581,
      "duration_s": 9758,
      "maneuver_count": 15,
      "roundabout_count": 1,
      "fetched_at": "2026-07-12T10:53:20.736Z",
      "fetch_error": null,
      "provider_meta": {
        "profile": "car",
        "points_sent": 2,
        "points_original": 2,
        "downsampled": false
      }
    },
    "openrouteservice": {
      "distance_m": 184587,
      "duration_s": 11045,
      "maneuver_count": 12,
      "roundabout_count": 1,
      "fetched_at": "2026-07-12T11:06:39.196Z",
      "fetch_error": null,
      "provider_meta": {
        "profile": "driving-car"
      }
    },
    "yandex_web": null
  },
  "motohud": {
    "distance_m": 184819,
    "duration_s": 11503,
    "step_count": 30,
    "router": "osrm",
    "fetched_at": "2026-10-22T07:48:35.865Z",
    "fetch_error": null
  },
  "metrics": {
    "graphhopper_vs_motohud": {
      "hausdorff_m": 521.9444057602943,
      "avg_lateral_m": 6.357116576971499,
      "p50_lateral_m": 1.015598731747978,
      "p95_lateral_m": 14.31425458394437,
      "max_lateral_m": 454.07858148406024,
      "length_diff_pct": 0.12877463897110145,
      "duration_diff_pct": 9.244791666666668,
      "maneuver_count_diff": 15,
      "roundabout_count_diff": null,
      "direction_mismatch_ratio": 0.00600400266844563,
      "waypoint_deviations_m": [
        0,
        0.08982835572119535
      ]
    },
    "ors_vs_motohud": {
      "hausdorff_m": 249.07277313983235,
      "avg_lateral_m": 3.9730236550252194,
      "p50_lateral_m": 1.0474850368286488,
      "p95_lateral_m": 14.166718673736565,
      "max_lateral_m": 237.8950102258155,
      "length_diff_pct": 0.12552821950124177,
      "duration_diff_pct": 2.7250744047619047,
      "maneuver_count_diff": 18,
      "roundabout_count_diff": null,
      "direction_mismatch_ratio": 0.00066711140760507,
      "waypoint_deviations_m": [
        0,
        0
      ]
    },
    "yandex_vs_motohud": null,
    "graphhopper_vs_ors": {
      "hausdorff_m": 521.9444057602943,
      "avg_lateral_m": 5.050593574728623,
      "p50_lateral_m": 0.8455419293751659,
      "p95_lateral_m": 11.741648362678868,
      "max_lateral_m": 521.9444057602943,
      "length_diff_pct": 0.003250605425260455,
      "duration_diff_pct": 13.189178110268498,
      "maneuver_count_diff": 3,
      "roundabout_count_diff": 0,
      "direction_mismatch_ratio": 0.00533689126084056,
      "waypoint_deviations_m": [
        0,
        0
      ]
    },
    "graphhopper_vs_yandex": null,
    "ors_vs_yandex": null,
    "consensus_deviation": {
      "refs_agree": true,
      "motohud_vs_consensus_p95_m": 14.31425458394437,
      "motohud_vs_consensus_avg_m": 5.165070115998359,
      "signal": "ok"
    },
    "coverage": {
      "references_available": [
        "graphhopper",
        "openrouteservice"
      ]
    }
  },
  "metadata": {
    "author": "generate-waypoints.mjs",
    "notes": "М4 Дон — южный участок · highway · OSRM 184.8 km",
    "known_issues": [],
    "compare_interpretation": null,
    "priority": "normal"
  },
  "status": "valid"
}
