{
  "fixture_id": "cfd81eec-3c97-4b71-a038-8e5c58ec0e81",
  "corpus_version": 1,
  "created_at": "2026-07-11T13:59:01.513Z",
  "last_verified_at": "2026-07-12T11:33:04.381Z",
  "source": "auto_generator",
  "category": "roundabouts",
  "region": "yekaterinburg",
  "tags": [
    "auto_v1",
    "roundabouts",
    "yekaterinburg"
  ],
  "waypoints": [
    {
      "lat": 55.735234,
      "lon": 37.523349,
      "label": "start_ring"
    },
    {
      "lat": 55.737082,
      "lon": 37.512748,
      "label": "finish_ring"
    }
  ],
  "constraints": {
    "distance_km_min": 5,
    "distance_km_max": 300,
    "sim_speed_kmh": 45
  },
  "references": {
    "graphhopper": {
      "distance_m": 6333,
      "duration_s": 599,
      "maneuver_count": 9,
      "roundabout_count": 0,
      "fetched_at": "2026-07-12T11:01:22.919Z",
      "fetch_error": null,
      "provider_meta": {
        "profile": "car",
        "points_sent": 2,
        "points_original": 2,
        "downsampled": false
      }
    },
    "openrouteservice": {
      "distance_m": 5913,
      "duration_s": 621,
      "maneuver_count": 7,
      "roundabout_count": 0,
      "fetched_at": "2026-07-12T11:08:23.701Z",
      "fetch_error": null,
      "provider_meta": {
        "profile": "driving-car"
      }
    },
    "yandex_web": null
  },
  "motohud": {
    "distance_m": 6350,
    "duration_s": 490,
    "step_count": 16,
    "router": "osrm",
    "fetched_at": "2026-10-22T07:50:19.751Z",
    "fetch_error": null
  },
  "metrics": {
    "graphhopper_vs_motohud": {
      "hausdorff_m": 0.4150442167023234,
      "avg_lateral_m": 0.0740838455942256,
      "p50_lateral_m": 0.02490169533677883,
      "p95_lateral_m": 0.2745463518649783,
      "max_lateral_m": 0.4150442167023234,
      "length_diff_pct": 0.26771653543307083,
      "duration_diff_pct": 22.244897959183675,
      "maneuver_count_diff": 7,
      "roundabout_count_diff": null,
      "direction_mismatch_ratio": 0,
      "waypoint_deviations_m": [
        0,
        0
      ]
    },
    "ors_vs_motohud": {
      "hausdorff_m": 129.9131954157835,
      "avg_lateral_m": 9.324110350587413,
      "p50_lateral_m": 0.0021669677077559447,
      "p95_lateral_m": 84.52768717786444,
      "max_lateral_m": 129.9131954157835,
      "length_diff_pct": 6.881889763779528,
      "duration_diff_pct": 26.73469387755102,
      "maneuver_count_diff": 9,
      "roundabout_count_diff": null,
      "direction_mismatch_ratio": 0.11764705882352941,
      "waypoint_deviations_m": [
        55.91874961564047,
        0
      ]
    },
    "yandex_vs_motohud": null,
    "graphhopper_vs_ors": {
      "hausdorff_m": 129.79528634224022,
      "avg_lateral_m": 9.339169867320047,
      "p50_lateral_m": 0.02405464753247249,
      "p95_lateral_m": 84.57164570670881,
      "max_lateral_m": 129.79528634224022,
      "length_diff_pct": 6.631927996210327,
      "duration_diff_pct": 3.672787979966611,
      "maneuver_count_diff": 2,
      "roundabout_count_diff": 0,
      "direction_mismatch_ratio": 0.11764705882352941,
      "waypoint_deviations_m": [
        55.91874961564047,
        0
      ]
    },
    "graphhopper_vs_yandex": null,
    "ors_vs_yandex": null,
    "consensus_deviation": {
      "refs_agree": false,
      "motohud_vs_consensus_p95_m": 84.52768717786444,
      "motohud_vs_consensus_avg_m": 4.699097098090819,
      "signal": "warn"
    },
    "coverage": {
      "references_available": [
        "graphhopper",
        "openrouteservice"
      ]
    }
  },
  "metadata": {
    "author": "generate-waypoints.mjs",
    "notes": "Екатеринбург · roundabouts · OSRM 6.3 km",
    "known_issues": [],
    "compare_interpretation": null,
    "priority": "normal"
  },
  "status": "valid"
}
