{
  "fixture_id": "6f0a6bcc-0f3c-429b-be5f-2f90a18e3224",
  "corpus_version": 1,
  "created_at": "2026-07-09T11:51:54.155Z",
  "last_verified_at": null,
  "source": "auto_generator",
  "category": "city",
  "region": "moscow_center",
  "tags": [
    "template"
  ],
  "waypoints": [
    {
      "lat": 55.7558,
      "lon": 37.6173,
      "label": "start"
    },
    {
      "lat": 55.78,
      "lon": 37.65,
      "label": "finish"
    }
  ],
  "constraints": {
    "distance_km_min": 5,
    "distance_km_max": 300,
    "sim_speed_kmh": 60
  },
  "references": {
    "graphhopper": null,
    "openrouteservice": null,
    "yandex_web": null
  },
  "motohud": {
    "distance_m": null,
    "duration_s": null,
    "step_count": null,
    "router": "osrm",
    "fetched_at": null,
    "fetch_error": null
  },
  "metrics": null,
  "metadata": {
    "author": "validate-schema",
    "notes": "template fixture",
    "known_issues": [],
    "compare_interpretation": null,
    "priority": "normal"
  },
  "status": "valid"
}
