{
  "fixture_id": "bcf693d0-e4fe-4b4d-b66c-1f9315426b96",
  "corpus_version": 1,
  "created_at": "2026-07-09T07:37:19.526Z",
  "last_verified_at": "2026-07-12T11:30:22.079Z",
  "source": "auto_generator",
  "category": "city",
  "region": "kazan",
  "tags": [
    "auto_v1",
    "city",
    "kazan"
  ],
  "waypoints": [
    {
      "lat": 55.816706,
      "lon": 49.211787,
      "label": "start"
    },
    {
      "lat": 55.733315,
      "lon": 49.268964,
      "label": "via_1"
    },
    {
      "lat": 55.791877,
      "lon": 49.057942,
      "label": "via_2"
    },
    {
      "lat": 55.782897,
      "lon": 49.139095,
      "label": "finish"
    }
  ],
  "constraints": {
    "distance_km_min": 5,
    "distance_km_max": 300,
    "sim_speed_kmh": 45
  },
  "references": {
    "graphhopper": {
      "distance_m": 42405,
      "duration_s": 5445,
      "maneuver_count": 50,
      "roundabout_count": 1,
      "fetched_at": "2026-07-12T10:59:22.368Z",
      "fetch_error": null,
      "provider_meta": {
        "profile": "car",
        "points_sent": 4,
        "points_original": 4,
        "downsampled": false
      }
    },
    "openrouteservice": {
      "distance_m": 42552,
      "duration_s": 4697,
      "maneuver_count": 48,
      "roundabout_count": 0,
      "fetched_at": "2026-07-12T11:07:57.690Z",
      "fetch_error": null,
      "provider_meta": {
        "profile": "driving-car"
      }
    },
    "yandex_web": {
      "distance_m": 50000,
      "duration_s": 6300,
      "maneuver_count": null,
      "roundabout_count": null,
      "fetched_at": "2026-07-09T11:50:19.008Z",
      "fetch_error": "polyline_not_extracted",
      "fetch_method": null,
      "provider_meta": {
        "polyline_score": null,
        "polyline_source": null,
        "candidates_seen": 18,
        "dom_raw": {
          "km": "50 км",
          "hours": 1,
          "mins": 45
        },
        "url": "https://yandex.ru/maps/?rtext=55.816706%2C49.211787~55.733315%2C49.268964~55.791877%2C49.057942~55.782897%2C49.139095&rtt=auto"
      }
    }
  },
  "motohud": {
    "distance_m": 43535,
    "duration_s": 4199,
    "step_count": 70,
    "router": "osrm",
    "fetched_at": "2026-10-22T07:49:53.902Z",
    "fetch_error": null
  },
  "metrics": {
    "graphhopper_vs_motohud": {
      "hausdorff_m": 1187.4052205622693,
      "avg_lateral_m": 157.157270328071,
      "p50_lateral_m": 0.9883518130599793,
      "p95_lateral_m": 720.4316293145602,
      "max_lateral_m": 1012.3753545083251,
      "length_diff_pct": 2.591137757563228,
      "duration_diff_pct": 29.642857142857142,
      "maneuver_count_diff": 20,
      "roundabout_count_diff": null,
      "direction_mismatch_ratio": 0.2971698113207547,
      "waypoint_deviations_m": [
        0,
        0,
        0,
        0
      ]
    },
    "ors_vs_motohud": {
      "hausdorff_m": 2275.8875082722993,
      "avg_lateral_m": 251.06418958178529,
      "p50_lateral_m": 2.493243718303519,
      "p95_lateral_m": 1266.5136674681341,
      "max_lateral_m": 1803.2510627519173,
      "length_diff_pct": 2.2534628902212117,
      "duration_diff_pct": 11.833333333333334,
      "maneuver_count_diff": 22,
      "roundabout_count_diff": null,
      "direction_mismatch_ratio": 0.4970414201183432,
      "waypoint_deviations_m": [
        0,
        0,
        0.06251394444386359,
        0
      ]
    },
    "yandex_vs_motohud": null,
    "graphhopper_vs_ors": {
      "hausdorff_m": 2274.2497589062787,
      "avg_lateral_m": 189.6067469382622,
      "p50_lateral_m": 0.4167966578367268,
      "p95_lateral_m": 1592.810427506611,
      "max_lateral_m": 1872.4520213880096,
      "length_diff_pct": 0.3466572338167669,
      "duration_diff_pct": 13.737373737373737,
      "maneuver_count_diff": 2,
      "roundabout_count_diff": 1,
      "direction_mismatch_ratio": 0.3680473372781065,
      "waypoint_deviations_m": [
        0,
        0,
        0.06251394444386359,
        0
      ]
    },
    "graphhopper_vs_yandex": null,
    "ors_vs_yandex": null,
    "consensus_deviation": {
      "refs_agree": false,
      "motohud_vs_consensus_p95_m": 1266.5136674681341,
      "motohud_vs_consensus_avg_m": 204.11072995492816,
      "signal": "fail"
    },
    "coverage": {
      "references_available": [
        "graphhopper",
        "openrouteservice"
      ]
    }
  },
  "metadata": {
    "author": "generate-waypoints.mjs",
    "notes": "Казань · city · OSRM 43.5 km",
    "known_issues": [],
    "compare_interpretation": null,
    "priority": "normal"
  },
  "status": "valid"
}
