{
  "fixture_id": "2b2f7517-2db5-4c9a-b425-041446e6f53f",
  "corpus_version": 1,
  "created_at": "2026-07-11T14:54:49.906Z",
  "last_verified_at": "2026-07-12T11:15:45.915Z",
  "source": "auto_generator",
  "category": "highway",
  "region": "m11_neva",
  "tags": [
    "auto_v1",
    "highway",
    "m11_neva"
  ],
  "waypoints": [
    {
      "lat": 59.189856,
      "lon": 36.773328,
      "label": "start"
    },
    {
      "lat": 57.919296,
      "lon": 35.322039,
      "label": "finish"
    }
  ],
  "constraints": {
    "distance_km_min": 5,
    "distance_km_max": 300,
    "sim_speed_kmh": 90
  },
  "references": {
    "graphhopper": {
      "distance_m": 285216,
      "duration_s": 15888,
      "maneuver_count": 18,
      "roundabout_count": 0,
      "fetched_at": "2026-07-12T09:44:08.172Z",
      "fetch_error": null,
      "provider_meta": {
        "profile": "car",
        "points_sent": 2,
        "points_original": 2,
        "downsampled": false
      }
    },
    "openrouteservice": {
      "distance_m": 285398,
      "duration_s": 20796,
      "maneuver_count": 21,
      "roundabout_count": 0,
      "fetched_at": "2026-07-12T11:06:05.136Z",
      "fetch_error": null,
      "provider_meta": {
        "profile": "driving-car"
      }
    },
    "yandex_web": null
  },
  "motohud": {
    "distance_m": 286076,
    "duration_s": 22994,
    "step_count": 42,
    "router": "osrm",
    "fetched_at": "2026-10-15T07:36:45.424Z",
    "fetch_error": null
  },
  "metrics": {
    "graphhopper_vs_motohud": {
      "hausdorff_m": 435.4988826692457,
      "avg_lateral_m": 12.49593039529605,
      "p50_lateral_m": 4.3201746695814105,
      "p95_lateral_m": 49.91249921876872,
      "max_lateral_m": 435.4988826692457,
      "length_diff_pct": 0.3006194158195724,
      "duration_diff_pct": 30.903714012351045,
      "maneuver_count_diff": 24,
      "roundabout_count_diff": null,
      "direction_mismatch_ratio": 0.009339559706470981,
      "waypoint_deviations_m": [
        0,
        0
      ]
    },
    "ors_vs_motohud": {
      "hausdorff_m": 356.2438551205333,
      "avg_lateral_m": 10.714732526598949,
      "p50_lateral_m": 3.8151942151888028,
      "p95_lateral_m": 42.2778025837085,
      "max_lateral_m": 356.2438551205333,
      "length_diff_pct": 0.23699995805310475,
      "duration_diff_pct": 9.559015395320518,
      "maneuver_count_diff": 21,
      "roundabout_count_diff": null,
      "direction_mismatch_ratio": 0.00533689126084056,
      "waypoint_deviations_m": [
        0,
        0
      ]
    },
    "yandex_vs_motohud": null,
    "graphhopper_vs_ors": {
      "hausdorff_m": 275.1272795925548,
      "avg_lateral_m": 10.175493492739957,
      "p50_lateral_m": 4.090022025013348,
      "p95_lateral_m": 37.34456138824658,
      "max_lateral_m": 275.1272795925548,
      "length_diff_pct": 0.06381128688432627,
      "duration_diff_pct": 30.891238670694865,
      "maneuver_count_diff": -3,
      "roundabout_count_diff": 0,
      "direction_mismatch_ratio": 0.00733822548365577,
      "waypoint_deviations_m": [
        0,
        0
      ]
    },
    "graphhopper_vs_yandex": null,
    "ors_vs_yandex": null,
    "consensus_deviation": {
      "refs_agree": false,
      "motohud_vs_consensus_p95_m": 49.91249921876872,
      "motohud_vs_consensus_avg_m": 11.6053314609475,
      "signal": "warn"
    },
    "coverage": {
      "references_available": [
        "graphhopper",
        "openrouteservice"
      ]
    }
  },
  "metadata": {
    "author": "generate-waypoints.mjs",
    "notes": "М11 Нева · highway · OSRM 286.1 km",
    "known_issues": [],
    "compare_interpretation": null,
    "priority": "normal"
  },
  "status": "valid"
}
